{
  "statementID": "e5027662-b2bf-4a55-8319-1e4ff1c7e6a2",
  "statementType": "personStatement",
  "isComponent": false,
  "personType": "knownPerson",
  "names": [
    {
      "fullName": "Roberto LÃ³pez"
    }
  ],
  "publicationDetails": {
    "publicationDate": "2017-12-01",
    "bodsVersion": "0.2",
    "publisher": {
      "name": "XXXXXXXXX"
    }
  }
}
